13:24:54.804506 IP GS-SGIP-72.36940 > 220.249.123.221.8802: Flags [S], seq 3479506814, win 14600, options [mss 1460,sackOK,TS val 4166347638 ecr 0,nop,wscale 7], length 0
13:24:54.809301 IP GS-SGIP-72.36941 > 220.249.123.221.8802: Flags [S], seq 2517223833, win 14600, options [mss 1460,sackOK,TS val 4166347643 ecr 0,nop,wscale 7], length 0
13:24:54.814174 IP GS-SGIP-72.36942 > 220.249.123.221.8802: Flags [S], seq 3281593327, win 14600, options [mss 1460,sackOK,TS val 4166347648 ecr 0,nop,wscale 7], length 0
13:24:54.816766 IP GS-SGIP-72.36943 > 220.249.123.221.8802: Flags [S], seq 4056622462, win 14600, options [mss 1460,sackOK,TS val 4166347650 ecr 0,nop,wscale 7], length 0
13:24:54.833410 IP GS-SGIP-72.36944 > 220.249.123.221.8802: Flags [S], seq 2048217437, win 14600, options [mss 1460,sackOK,TS val 4166347667 ecr 0,nop,wscale 7], length 0
13:24:54.838219 IP GS-SGIP-72.36945 > 220.249.123.221.8802: Flags [S], seq 2344126546, win 14600, options [mss 1460,sackOK,TS val 4166347672 ecr 0,nop,wscale 7], length 0
13:24:54.838379 IP GS-SGIP-72.36946 > 220.249.123.221.8802: Flags [S], seq 841015956, win 14600, options [mss 1460,sackOK,TS val 4166347672 ecr 0,nop,wscale 7], length 0
13:24:54.838499 IP GS-SGIP-72.36947 > 220.249.123.221.8802: Flags [S], seq 585616104, win 14600, options [mss 1460,sackOK,TS val 4166347672 ecr 0,nop,wscale 7], length 0
13:24:54.843317 IP GS-SGIP-72.36948 > 220.249.123.221.8802: Flags [S], seq 159673168, win 14600, options [mss 1460,sackOK,TS val 4166347677 ecr 0,nop,wscale 7], length 0
13:24:54.845814 IP GS-SGIP-72.36949 > 220.249.123.221.8802: Flags [S], seq 411424535, win 14600, options [mss 1460,sackOK,TS val 4166347679 ecr 0,nop,wscale 7], length 0
13:24:54.850662 IP 220.249.123.221.8802 > GS-SGIP-72.36940: Flags [S.], seq 3978157727, ack 3479506815, win 65535, options [mss 1460], length 0
13:24:54.850690 IP GS-SGIP-72.36940 > 220.249.123.221.8802: Flags [.], ack 1, win 14600, length 0
13:24:54.853935 IP GS-SGIP-72.36940 > 220.249.123.221.8802: Flags [P.], seq 1:62, ack 1, win 14600, length 61
13:24:54.855344 IP 220.249.123.221.8802 > GS-SGIP-72.36941: Flags [S.], seq 3791479956, ack 2517223834, win 65535, options [mss 1460], length 0
13:24:54.855366 IP GS-SGIP-72.36941 > 220.249.123.221.8802: Flags [.], ack 1, win 14600, length 0
13:24:54.858785 IP GS-SGIP-72.36941 > 220.249.123.221.8802: Flags [P.], seq 1:62, ack 1, win 14600, length 61
13:24:54.860095 IP 220.249.123.221.8802 > GS-SGIP-72.36942: Flags [S.], seq 3058620537, ack 3281593328, win 65535, options [mss 1460], length 0
13:24:54.860116 IP GS-SGIP-72.36942 > 220.249.123.221.8802: Flags [.], ack 1, win 14600, length 0
13:24:54.862574 IP 220.249.123.221.8802 > GS-SGIP-72.36943: Flags [S.], seq 3660921025, ack 4056622463, win 65535, options [mss 1460], length 0
13:24:54.862593 IP GS-SGIP-72.36943 > 220.249.123.221.8802: Flags [.], ack 1, win 14600, length 0
13:24:54.863725 IP GS-SGIP-72.36942 > 220.249.123.221.8802: Flags [P.], seq 1:62, ack 1, win 14600, length 61
13:24:54.866221 IP GS-SGIP-72.36943 > 220.249.123.221.8802: Flags [P.], seq 1:62, ack 1, win 14600, length 61
13:24:54.879648 IP 220.249.123.221.8802 > GS-SGIP-72.36944: Flags [S.], seq 1085863750, ack 2048217438, win 65535, options [mss 1460], length 0
13:24:54.879673 IP GS-SGIP-72.36944 > 220.249.123.221.8802: Flags [.], ack 1, win 14600, length 0
13:24:54.883552 IP GS-SGIP-72.36944 > 220.249.123.221.8802: Flags [P.], seq 1:62, ack 1, win 14600, length 61
13:24:54.884283 IP 220.249.123.221.8802 > GS-SGIP-72.36946: Flags [S.], seq 1415559078, ack 841015957, win 65535, options [mss 1460], length 0
13:24:54.884302 IP GS-SGIP-72.36946 > 220.249.123.221.8802: Flags [.], ack 1, win 14600, length 0
13:24:54.884996 IP 220.249.123.221.8802 > GS-SGIP-72.36947: Flags [S.], seq 71274798, ack 585616105, win 65535, options [mss 1460], length 0
13:24:54.885012 IP GS-SGIP-72.36947 > 220.249.123.221.8802: Flags [.], ack 1, win 14600, length 0
13:24:54.885079 IP 220.249.123.221.8802 > GS-SGIP-72.36945: Flags [S.], seq 3737474459, ack 2344126547, win 65535, options [mss 1460], length 0
13:24:54.885096 IP GS-SGIP-72.36945 > 220.249.123.221.8802: Flags [.], ack 1, win 14600, length 0
13:25:04.897749 IP GS-SGIP-72.37047 > 220.249.123.221.8802: Flags [S], seq 2856102357, win 14600, options [mss 1460,sackOK,TS val 4166357731 ecr 0,nop,wscale 7], length 0
13:25:04.903383 IP GS-SGIP-72.37048 > 220.249.123.221.8802: Flags [S], seq 3560840909, win 14600, options [mss 1460,sackOK,TS val 4166357737 ecr 0,nop,wscale 7], length 0
13:25:04.909977 IP GS-SGIP-72.37049 > 220.249.123.221.8802: Flags [S], seq 571928346, win 14600, options [mss 1460,sackOK,TS val 4166357744 ecr 0,nop,wscale 7], length 0
13:25:04.910189 IP GS-SGIP-72.37050 > 220.249.123.221.8802: Flags [S], seq 2439948963, win 14600, options [mss 1460,sackOK,TS val 4166357744 ecr 0,nop,wscale 7], length 0
13:25:04.928061 IP GS-SGIP-72.37051 > 220.249.123.221.8802: Flags [S], seq 3218037413, win 14600, options [mss 1460,sackOK,TS val 4166357762 ecr 0,nop,wscale 7], length 0
13:25:04.933046 IP GS-SGIP-72.37052 > 220.249.123.221.8802: Flags [S], seq 436770423, win 14600, options [mss 1460,sackOK,TS val 4166357767 ecr 0,nop,wscale 7], length 0
13:25:04.935680 IP GS-SGIP-72.37053 > 220.249.123.221.8802: Flags [S], seq 3559621753, win 14600, options [mss 1460,sackOK,TS val 4166357769 ecr 0,nop,wscale 7], length 0
13:25:04.935829 IP GS-SGIP-72.37054 > 220.249.123.221.8802: Flags [S], seq 360656333, win 14600, options [mss 1460,sackOK,TS val 4166357769 ecr 0,nop,wscale 7], length 0
13:25:04.938232 IP GS-SGIP-72.37055 > 220.249.123.221.8802: Flags [S], seq 3077843649, win 14600, options [mss 1460,sackOK,TS val 4166357772 ecr 0,nop,wscale 7], length 0
13:25:04.938381 IP GS-SGIP-72.37056 > 220.249.123.221.8802: Flags [S], seq 1574784928, win 14600, options [mss 1460,sackOK,TS val 4166357772 ecr 0,nop,wscale 7], length 0
13:25:04.943961 IP 220.249.123.221.8802 > GS-SGIP-72.37047: Flags [S.], seq 2748252494, ack 2856102358, win 65535, options [mss 1460], length 0
13:25:04.943994 IP GS-SGIP-72.37047 > 220.249.123.221.8802: Flags [.], ack 1, win 14600, length 0
13:25:04.948529 IP GS-SGIP-72.37047 > 220.249.123.221.8802: Flags [P.], seq 1:62, ack 1, win 14600, length 61
13:25:04.949424 IP 220.249.123.221.8802 > GS-SGIP-72.37048: Flags [S.], seq 1127921192, ack 3560840910, win 65535, options [mss 1460], length 0
13:25:04.949446 IP GS-SGIP-72.37048 > 220.249.123.221.8802: Flags [.], ack 1, win 14600, length 0
13:25:04.953178 IP GS-SGIP-72.37048 > 220.249.123.221.8802: Flags [P.], seq 1:62, ack 1, win 14600, length 61
13:25:04.956056 IP 220.249.123.221.8802 > GS-SGIP-72.37049: Flags [S.], seq 777514770, ack 571928347, win 65535, options [mss 1460], length 0
13:25:04.956084 IP GS-SGIP-72.37049 > 220.249.123.221.8802: Flags [.], ack 1, win 14600, length 0
13:25:04.956091 IP 220.249.123.221.8802 > GS-SGIP-72.37050: Flags [S.], seq 2327077552, ack 2439948964, win 65535, options [mss 1460], length 0
13:25:04.956101 IP GS-SGIP-72.37050 > 220.249.123.221.8802: Flags [.], ack 1, win 14600, length 0
13:25:04.961571 IP GS-SGIP-72.37049 > 220.249.123.221.8802: Flags [P.], seq 1:62, ack 1, win 14600, length 61
13:25:04.962043 IP GS-SGIP-72.37050 > 220.249.123.221.8802: Flags [P.], seq 1:62, ack 1, win 14600, length 61
13:25:04.974096 IP 220.249.123.221.8802 > GS-SGIP-72.37051: Flags [S.], seq 787405911, ack 3218037414, win 65535, options [mss 1460], length 0
13:25:04.974118 IP GS-SGIP-72.37051 > 220.249.123.221.8802: Flags [.], ack 1, win 14600, length 0
13:25:04.978916 IP GS-SGIP-72.37051 > 220.249.123.221.8802: Flags [P.], seq 1:62, ack 1, win 14600, length 61
13:25:04.979034 IP 220.249.123.221.8802 > GS-SGIP-72.37052: Flags [S.], seq 2098324230, ack 436770424, win 65535, options [mss 1460], length 0
13:25:04.979060 IP GS-SGIP-72.37052 > 220.249.123.221.8802: Flags [.], ack 1, win 14600, length 0
13:25:04.981403 IP 220.249.123.221.8802 > GS-SGIP-72.37053: Flags [S.], seq 26818691, ack 3559621754, win 65535, options [mss 1460], length 0
13:25:04.981426 IP GS-SGIP-72.37053 > 220.249.123.221.8802: Flags [.], ack 1, win 14600, length 0
13:25:04.981962 IP 220.249.123.221.8802 > GS-SGIP-72.37054: Flags [S.], seq 3112203793, ack 360656334, win 65535, options [mss 1460], length 0
13:25:04.981982 IP GS-SGIP-72.37054 > 220.249.123.221.8802: Flags [.], ack 1, win 14600, length 0
13:25:04.983901 IP GS-SGIP-72.37052 > 220.249.123.221.8802: Flags [P.], seq 1:62, ack 1, win 14600, length 61
13:25:04.984078 IP 220.249.123.221.8802 > GS-SGIP-72.37056: Flags [S.], seq 1027539927, ack 1574784929, win 65535, options [mss 1460], length 0
13:25:04.984098 IP GS-SGIP-72.37056 > 220.249.123.221.8802: Flags [.], ack 1, win 14600, length 0
13:25:04.984105 IP 220.249.123.221.8802 > GS-SGIP-72.37055: Flags [S.], seq 1528987298, ack 3077843650, win 65535, options [mss 1460], length 0
13:25:04.984114 IP GS-SGIP-72.37055 > 220.249.123.221.8802: Flags [.], ack 1, win 14600, length 0
13:25:04.986481 IP GS-SGIP-72.37054 > 220.249.123.221.8802: Flags [P.], seq 1:62, ack 1, win 14600, length 61
13:25:04.986673 IP GS-SGIP-72.37053 > 220.249.123.221.8802: Flags [P.], seq 1:62, ack 1, win 14600, length 61
13:25:04.989112 IP GS-SGIP-72.37055 > 220.249.123.221.8802: Flags [P.], seq 1:62, ack 1, win 14600, length 61
13:25:04.989312 IP GS-SGIP-72.37056 > 220.249.123.221.8802: Flags [P.], seq 1:62, ack 1, win 14600, length 61
13:25:04.989406 IP 220.249.123.221.8802 > GS-SGIP-72.37047: Flags [R], seq 2748252495, win 14, length 0
13:25:04.994856 IP 220.249.123.221.8802 > GS-SGIP-72.37048: Flags [R], seq 1127921193, win 14, length 0
13:25:05.001337 IP 220.249.123.221.8802 > GS-SGIP-72.37049: Flags [R], seq 777514771, win 14, length 0
13:25:05.001363 IP 220.249.123.221.8802 > GS-SGIP-72.37050: Flags [R], seq 2327077553, win 14, length 0
13:25:05.019726 IP 220.249.123.221.8802 > GS-SGIP-72.37051: Flags [R], seq 787405912, win 14, length 0
13:25:05.024526 IP 220.249.123.221.8802 > GS-SGIP-72.37052: Flags [R], seq 2098324231, win 14, length 0
13:25:05.027077 IP 220.249.123.221.8802 > GS-SGIP-72.37053: Flags [R], seq 26818692, win 14, length 0
13:25:05.027405 IP 220.249.123.221.8802 > GS-SGIP-72.37054: Flags [R], seq 3112203794, win 14, length 0
13:25:05.029380 IP 220.249.123.221.8802 > GS-SGIP-72.37055: Flags [R], seq 1528987299, win 14, length 0
13:25:05.029403 IP 220.249.123.221.8802 > GS-SGIP-72.37056: Flags [R], seq 1027539928, win 14, length 0
13:25:14.993920 IP GS-SGIP-72.37143 > 220.249.123.221.8802: Flags [S], seq 3122505556, win 14600, options [mss 1460,sackOK,TS val 4166367827 ecr 0,nop,wscale 7], length 0
13:25:14.999580 IP GS-SGIP-72.37144 > 220.249.123.221.8802: Flags [S], seq 4127054351, win 14600, options [mss 1460,sackOK,TS val 4166367833 ecr 0,nop,wscale 7], length 0
13:25:15.005081 IP GS-SGIP-72.37145 > 220.249.123.221.8802: Flags [S], seq 589414046, win 14600, options [mss 1460,sackOK,TS val 4166367839 ecr 0,nop,wscale 7], length 0
13:25:15.005168 IP GS-SGIP-72.37146 > 220.249.123.221.8802: Flags [S], seq 2131235946, win 14600, options [mss 1460,sackOK,TS val 4166367839 ecr 0,nop,wscale 7], length 0
13:25:15.021574 IP GS-SGIP-72.37147 > 220.249.123.221.8802: Flags [S], seq 3720355077, win 14600, options [mss 1460,sackOK,TS val 4166367855 ecr 0,nop,wscale 7], length 0
13:25:15.027219 IP GS-SGIP-72.37148 > 220.249.123.221.8802: Flags [S], seq 2540382548, win 14600, options [mss 1460,sackOK,TS val 4166367861 ecr 0,nop,wscale 7], length 0
13:25:15.029174 IP GS-SGIP-72.37149 > 220.249.123.221.8802: Flags [S], seq 135172921, win 14600, options [mss 1460,sackOK,TS val 4166367863 ecr 0,nop,wscale 7], length 0
13:25:15.029249 IP GS-SGIP-72.37150 > 220.249.123.221.8802: Flags [S], seq 1215530470, win 14600, options [mss 1460,sackOK,TS val 4166367863 ecr 0,nop,wscale 7], length 0
13:25:15.031137 IP GS-SGIP-72.37151 > 220.249.123.221.8802: Flags [S], seq 1635620390, win 14600, options [mss 1460,sackOK,TS val 4166367865 ecr 0,nop,wscale 7], length 0
13:25:15.033057 IP GS-SGIP-72.37152 > 220.249.123.221.8802: Flags [S], seq 992036080, win 14600, options [mss 1460,sackOK,TS val 4166367867 ecr 0,nop,wscale 7], length 0
13:25:15.039850 IP 220.249.123.221.8802 > GS-SGIP-72.37143: Flags [S.], seq 3172547998, ack 3122505557, win 65535, options [mss 1460], length 0
13:25:15.039866 IP GS-SGIP-72.37143 > 220.249.123.221.8802: Flags [.], ack 1, win 14600, length 0
13:25:15.042549 IP GS-SGIP-72.37143 > 220.249.123.221.8802: Flags [P.], seq 1:62, ack 1, win 14600, length 61
13:25:15.045566 IP 220.249.123.221.8802 > GS-SGIP-72.37144: Flags [S.], seq 302413759, ack 4127054352, win 65535, options [mss 1460], length 0
13:25:15.045584 IP GS-SGIP-72.37144 > 220.249.123.221.8802: Flags [.], ack 1, win 14600, length 0
13:25:15.048122 IP GS-SGIP-72.37144 > 220.249.123.221.8802: Flags [P.], seq 1:62, ack 1, win 14600, length 61
13:25:15.051039 IP 220.249.123.221.8802 > GS-SGIP-72.37146: Flags [S.], seq 2063731034, ack 2131235947, win 65535, options [mss 1460], length 0
13:25:15.051058 IP GS-SGIP-72.37146 > 220.249.123.221.8802: Flags [.], ack 1, win 14600, length 0
13:25:15.051064 IP 220.249.123.221.8802 > GS-SGIP-72.37145: Flags [S.], seq 1977750918, ack 589414047, win 65535, options [mss 1460], length 0
13:25:15.051072 IP GS-SGIP-72.37145 > 220.249.123.221.8802: Flags [.], ack 1, win 14600, length 0
13:25:15.054778 IP GS-SGIP-72.37146 > 220.249.123.221.8802: Flags [P.], seq 1:62, ack 1, win 14600, length 61
13:25:15.054899 IP GS-SGIP-72.37145 > 220.249.123.221.8802: Flags [P.], seq 1:62, ack 1, win 14600, length 61
13:25:15.067459 IP 220.249.123.221.8802 > GS-SGIP-72.37147: Flags [S.], seq 850495720, ack 3720355078, win 65535, options [mss 1460], length 0
13:25:15.067491 IP GS-SGIP-72.37147 > 220.249.123.221.8802: Flags [.], ack 1, win 14600, length 0
13:25:15.071073 IP GS-SGIP-72.37147 > 220.249.123.221.8802: Flags [P.], seq 1:62, ack 1, win 14600, length 61
13:25:15.073089 IP 220.249.123.221.8802 > GS-SGIP-72.37148: Flags [S.], seq 4037522454, ack 2540382549, win 65535, options [mss 1460], length 0
13:25:15.073114 IP GS-SGIP-72.37148 > 220.249.123.221.8802: Flags [.], ack 1, win 14600, length 0
13:25:15.075060 IP 220.249.123.221.8802 > GS-SGIP-72.37149: Flags [S.], seq 3047810491, ack 135172922, win 65535, options [mss 1460], length 0
13:25:15.075076 IP GS-SGIP-72.37149 > 220.249.123.221.8802: Flags [.], ack 1, win 14600, length 0
13:25:15.075532 IP 220.249.123.221.8802 > GS-SGIP-72.37150: Flags [S.], seq 1094322649, ack 1215530471, win 65535, options [mss 1460], length 0
13:25:15.075542 IP GS-SGIP-72.37150 > 220.249.123.221.8802: Flags [.], ack 1, win 14600, length 0
13:25:15.076439 IP GS-SGIP-72.37148 > 220.249.123.221.8802: Flags [P.], seq 1:62, ack 1, win 14600, length 61
13:25:15.077125 IP 220.249.123.221.8802 > GS-SGIP-72.37151: Flags [S.], seq 2318617385, ack 1635620391, win 65535, options [mss 1460], length 0
13:25:15.077138 IP GS-SGIP-72.37151 > 220.249.123.221.8802: Flags [.], ack 1, win 14600, length 0
13:25:15.078271 IP GS-SGIP-72.37149 > 220.249.123.221.8802: Flags [P.], seq 1:62, ack 1, win 14600, length 61
13:25:15.078373 IP GS-SGIP-72.37150 > 220.249.123.221.8802: Flags [P.], seq 1:62, ack 1, win 14600, length 61
13:25:15.078875 IP 220.249.123.221.8802 > GS-SGIP-72.37152: Flags [S.], seq 193896870, ack 992036081, win 65535, options [mss 1460], length 0
13:25:15.078889 IP GS-SGIP-72.37152 > 220.249.123.221.8802: Flags [.], ack 1, win 14600, length 0
13:25:15.080217 IP GS-SGIP-72.37151 > 220.249.123.221.8802: Flags [P.], seq 1:62, ack 1, win 14600, length 61
13:25:15.082120 IP GS-SGIP-72.37152 > 220.249.123.221.8802: Flags [P.], seq 1:62, ack 1, win 14600, length 61
13:25:15.085378 IP 220.249.123.221.8802 > GS-SGIP-72.37143: Flags [R], seq 3172547999, win 14, length 0
13:25:15.091068 IP 220.249.123.221.8802 > GS-SGIP-72.37144: Flags [R], seq 302413760, win 14, length 0
13:25:15.096491 IP 220.249.123.221.8802 > GS-SGIP-72.37145: Flags [R], seq 1977750919, win 14, length 0
13:25:15.096509 IP 220.249.123.221.8802 > GS-SGIP-72.37146: Flags [R], seq 2063731035, win 14, length 0
13:25:15.112931 IP 220.249.123.221.8802 > GS-SGIP-72.37147: Flags [R], seq 850495721, win 14, length 0
13:25:15.118580 IP 220.249.123.221.8802 > GS-SGIP-72.37148: Flags [R], seq 4037522455, win 14, length 0
13:25:15.120605 IP 220.249.123.221.8802 > GS-SGIP-72.37149: Flags [R], seq 3047810492, win 14, length 0
13:25:15.121037 IP 220.249.123.221.8802 > GS-SGIP-72.37150: Flags [R], seq 1094322650, win 14, length 0
13:25:15.122896 IP 220.249.123.221.8802 > GS-SGIP-72.37151: Flags [R], seq 2318617386, win 14, length 0
13:25:15.124370 IP 220.249.123.221.8802 > GS-SGIP-72.37152: Flags [R], seq 193896871, win 14, length 0
13:25:25.086541 IP GS-SGIP-72.37255 > 220.249.123.221.8802: Flags [S], seq 146978772, win 14600, options [mss 1460,sackOK,TS val 4166377920 ecr 0,nop,wscale 7], length 0
13:25:25.092551 IP GS-SGIP-72.37256 > 220.249.123.221.8802: Flags [S], seq 2236912551, win 14600, options [mss 1460,sackOK,TS val 4166377926 ecr 0,nop,wscale 7], length 0
13:25:25.097304 IP GS-SGIP-72.37257 > 220.249.123.221.8802: Flags [S], seq 13497037, win 14600, options [mss 1460,sackOK,TS val 4166377931 ecr 0,nop,wscale 7], length 0
13:25:25.099879 IP GS-SGIP-72.37258 > 220.249.123.221.8802: Flags [S], seq 1222046908, win 14600, options [mss 1460,sackOK,TS val 4166377933 ecr 0,nop,wscale 7], length 0
13:25:25.116780 IP GS-SGIP-72.37259 > 220.249.123.221.8802: Flags [S], seq 739408547, win 14600, options [mss 1460,sackOK,TS val 4166377950 ecr 0,nop,wscale 7], length 0
13:25:25.121754 IP GS-SGIP-72.37260 > 220.249.123.221.8802: Flags [S], seq 2789475432, win 14600, options [mss 1460,sackOK,TS val 4166377955 ecr 0,nop,wscale 7], length 0
13:25:25.124355 IP GS-SGIP-72.37261 > 220.249.123.221.8802: Flags [S], seq 728109333, win 14600, options [mss 1460,sackOK,TS val 4166377958 ecr 0,nop,wscale 7], length 0
13:25:25.124467 IP GS-SGIP-72.37262 > 220.249.123.221.8802: Flags [S], seq 539298856, win 14600, options [mss 1460,sackOK,TS val 4166377958 ecr 0,nop,wscale 7], length 0
13:25:25.126862 IP GS-SGIP-72.37263 > 220.249.123.221.8802: Flags [S], seq 3845806530, win 14600, options [mss 1460,sackOK,TS val 4166377960 ecr 0,nop,wscale 7], length 0
13:25:25.129256 IP GS-SGIP-72.37264 > 220.249.123.221.8802: Flags [S], seq 74761332, win 14600, options [mss 1460,sackOK,TS val 4166377963 ecr 0,nop,wscale 7], length 0
13:25:25.132762 IP 220.249.123.221.8802 > GS-SGIP-72.37255: Flags [S.], seq 2769669494, ack 146978773, win 65535, options [mss 1460], length 0
13:25:25.132787 IP GS-SGIP-72.37255 > 220.249.123.221.8802: Flags [.], ack 1, win 14600, length 0
13:25:25.137093 IP GS-SGIP-72.37255 > 220.249.123.221.8802: Flags [P.], seq 1:62, ack 1, win 14600, length 61
13:25:25.138359 IP 220.249.123.221.8802 > GS-SGIP-72.37256: Flags [S.], seq 2792136968, ack 2236912552, win 65535, options [mss 1460], length 0
13:25:25.138384 IP GS-SGIP-72.37256 > 220.249.123.221.8802: Flags [.], ack 1, win 14600, length 0
13:25:25.141748 IP GS-SGIP-72.37256 > 220.249.123.221.8802: Flags [P.], seq 1:62, ack 1, win 14600, length 61
13:25:25.143303 IP 220.249.123.221.8802 > GS-SGIP-72.37257: Flags [S.], seq 2207826906, ack 13497038, win 65535, options [mss 1460], length 0
13:25:25.143333 IP GS-SGIP-72.37257 > 220.249.123.221.8802: Flags [.], ack 1, win 14600, length 0
13:25:25.146736 IP GS-SGIP-72.37257 > 220.249.123.221.8802: Flags [P.], seq 1:62, ack 1, win 14600, length 61
13:25:25.146836 IP 220.249.123.221.8802 > GS-SGIP-72.37258: Flags [S.], seq 4096476721, ack 1222046909, win 65535, options [mss 1460], length 0
13:25:25.146866 IP GS-SGIP-72.37258 > 220.249.123.221.8802: Flags [.], ack 1, win 14600, length 0
13:25:25.152138 IP GS-SGIP-72.37258 > 220.249.123.221.8802: Flags [P.], seq 1:62, ack 1, win 14600, length 61
13:25:25.162848 IP 220.249.123.221.8802 > GS-SGIP-72.37259: Flags [S.], seq 2222877871, ack 739408548, win 65535, options [mss 1460], length 0
13:25:25.162879 IP GS-SGIP-72.37259 > 220.249.123.221.8802: Flags [.], ack 1, win 14600, length 0
13:25:25.166873 IP GS-SGIP-72.37259 > 220.249.123.221.8802: Flags [P.], seq 1:62, ack 1, win 14600, length 61
13:25:25.167605 IP 220.249.123.221.8802 > GS-SGIP-72.37260: Flags [S.], seq 1723339717, ack 2789475433, win 65535, options [mss 1460], length 0
13:25:25.167633 IP GS-SGIP-72.37260 > 220.249.123.221.8802: Flags [.], ack 1, win 14600, length 0
13:25:25.170153 IP 220.249.123.221.8802 > GS-SGIP-72.37262: Flags [S.], seq 2810729186, ack 539298857, win 65535, options [mss 1460], length 0
13:25:25.170183 IP GS-SGIP-72.37262 > 220.249.123.221.8802: Flags [.], ack 1, win 14600, length 0
13:25:25.170191 IP 220.249.123.221.8802 > GS-SGIP-72.37261: Flags [S.], seq 2148605449, ack 728109334, win 65535, options [mss 1460], length 0
13:25:25.170206 IP GS-SGIP-72.37261 > 220.249.123.221.8802: Flags [.], ack 1, win 14600, length 0
13:25:25.172136 IP GS-SGIP-72.37260 > 220.249.123.221.8802: Flags [P.], seq 1:62, ack 1, win 14600, length 61
13:25:25.172896 IP 220.249.123.221.8802 > GS-SGIP-72.37263: Flags [S.], seq 892613315, ack 3845806531, win 65535, options [mss 1460], length 0
13:25:25.172928 IP GS-SGIP-72.37263 > 220.249.123.221.8802: Flags [.], ack 1, win 14600, length 0
13:25:25.174930 IP GS-SGIP-72.37261 > 220.249.123.221.8802: Flags [P.], seq 1:62, ack 1, win 14600, length 61
13:25:25.175133 IP GS-SGIP-72.37262 > 220.249.123.221.8802: Flags [P.], seq 1:62, ack 1, win 14600, length 61
13:25:25.175237 IP 220.249.123.221.8802 > GS-SGIP-72.37264: Flags [S.], seq 134586277, ack 74761333, win 65535, options [mss 1460], length 0
13:25:25.175261 IP GS-SGIP-72.37264 > 220.249.123.221.8802: Flags [.], ack 1, win 14600, length 0
13:25:25.177671 IP GS-SGIP-72.37263 > 220.249.123.221.8802: Flags [P.], seq 1:62, ack 1, win 14600, length 61
13:25:25.178473 IP 220.249.123.221.8802 > GS-SGIP-72.37255: Flags [R], seq 2769669495, win 14, length 0
13:25:25.180272 IP GS-SGIP-72.37264 > 220.249.123.221.8802: Flags [P.], seq 1:62, ack 1, win 14600, length 61
13:25:25.183990 IP 220.249.123.221.8802 > GS-SGIP-72.37256: Flags [R], seq 2792136969, win 14, length 0
13:25:25.188856 IP 220.249.123.221.8802 > GS-SGIP-72.37257: Flags [R], seq 2207826907, win 14, length 0
13:25:25.192325 IP 220.249.123.221.8802 > GS-SGIP-72.37258: Flags [R], seq 4096476722, win 14, length 0
13:25:25.208232 IP 220.249.123.221.8802 > GS-SGIP-72.37259: Flags [R], seq 2222877872, win 14, length 0
13:25:25.213153 IP 220.249.123.221.8802 > GS-SGIP-72.37260: Flags [R], seq 1723339718, win 14, length 0
13:25:25.215605 IP 220.249.123.221.8802 > GS-SGIP-72.37262: Flags [R], seq 2810729187, win 14, length 0
13:25:25.215628 IP 220.249.123.221.8802 > GS-SGIP-72.37261: Flags [R], seq 2148605450, win 14, length 0
13:25:25.218349 IP 220.249.123.221.8802 > GS-SGIP-72.37263: Flags [R], seq 892613316, win 14, length 0
13:25:25.220740 IP 220.249.123.221.8802 > GS-SGIP-72.37264: Flags [R], seq 134586278, win 14, length 0

